{
  "schemaVersion": 1,
  "id": "climbing-stairs",
  "subject": "dsa",
  "track": "1d-dp",
  "title": "Climbing Stairs",
  "difficulty": "easy",
  "summary": "The number of ways to reach a step is the ways to reach the two steps below it, since your last move was a 1-step or a 2-step. Fill that up from the bottom.",
  "problem": "You climb a staircase of n steps, taking 1 or 2 steps at a time. How many distinct ways can you reach the top?",
  "example": { "input": "n = 5", "output": "8" },
  "steps": [
    {
      "caption": "Climb 5 steps, taking 1 or 2 at a time — count the distinct ways. Let dp[i] = the number of ways to reach step i.",
      "visual": { "type": "array", "cells": ["?", "?", "?", "?", "?", "?"] }
    },
    {
      "caption": "Base cases: dp[0] = 1 (you're already there) and dp[1] = 1 (a single 1-step). The '?' slots are still unknown.",
      "visual": { "type": "array", "cells": [1, 1, "?", "?", "?", "?"], "highlights": [{ "range": [0, 1], "state": "active" }] }
    },
    {
      "caption": "To land on step 2 your last move came from step 1 (a 1-step) or step 0 (a 2-step): dp[2] = dp[1] + dp[0] = 2.",
      "visual": { "type": "array", "cells": [1, 1, 2, "?", "?", "?"], "pointers": [{ "label": "i", "index": 2 }], "highlights": [{ "range": [0, 1], "state": "compare" }, { "index": 2, "state": "active" }] }
    },
    {
      "caption": "Same rule everywhere: dp[3] = dp[2] + dp[1] = 2 + 1 = 3.",
      "visual": { "type": "array", "cells": [1, 1, 2, 3, "?", "?"], "pointers": [{ "label": "i", "index": 3 }], "highlights": [{ "range": [1, 2], "state": "compare" }, { "index": 3, "state": "active" }] }
    },
    {
      "caption": "dp[4] = dp[3] + dp[2] = 3 + 2 = 5.",
      "visual": { "type": "array", "cells": [1, 1, 2, 3, 5, "?"], "pointers": [{ "label": "i", "index": 4 }], "highlights": [{ "range": [2, 3], "state": "compare" }, { "index": 4, "state": "active" }] }
    },
    {
      "caption": "dp[5] = dp[4] + dp[3] = 5 + 3 = 8.",
      "visual": { "type": "array", "cells": [1, 1, 2, 3, 5, 8], "pointers": [{ "label": "i", "index": 5 }], "highlights": [{ "range": [3, 4], "state": "compare" }, { "index": 5, "state": "active" }] }
    },
    {
      "caption": "There are 8 distinct ways to climb 5 steps — each value is just the sum of the two before it.",
      "visual": { "type": "array", "cells": [1, 1, 2, 3, 5, 8], "highlights": [{ "range": [0, 5], "state": "done" }] }
    }
  ]
}
