{
  "schemaVersion": 1,
  "id": "max-area-of-island",
  "subject": "dsa",
  "track": "graphs",
  "title": "Max Area of Island",
  "difficulty": "medium",
  "summary": "Scan the grid for land, and at each unvisited land cell flood-fill its whole island counting cells, tracking the largest area seen.",
  "problem": "In a grid of 1s (land) and 0s (water), return the area of the largest island. An island is land connected 4-directionally.",
  "example": { "input": "[[1,1,0,0],[1,0,0,1],[0,0,1,1],[0,0,1,0]]", "output": "4" },
  "steps": [
    {
      "caption": "Find the largest island. Flood-fill each island, count its cells, and keep the biggest area.",
      "visual": { "type": "grid", "rows": [[1, 1, 0, 0], [1, 0, 0, 1], [0, 0, 1, 1], [0, 0, 1, 0]] }
    },
    {
      "caption": "Start at land (0,0) and flood-fill. This island spans (0,0), (0,1), (1,0). Its area is 3.",
      "visual": { "type": "grid", "rows": [[1, 1, 0, 0], [1, 0, 0, 1], [0, 0, 1, 1], [0, 0, 1, 0]], "highlights": [{ "row": 0, "col": 0, "state": "active" }, { "row": 0, "col": 1, "state": "active" }, { "row": 1, "col": 0, "state": "active" }] }
    },
    {
      "caption": "That island is done with area 3. Keep scanning and find new land at (1,3).",
      "visual": { "type": "grid", "rows": [[1, 1, 0, 0], [1, 0, 0, 1], [0, 0, 1, 1], [0, 0, 1, 0]], "highlights": [{ "row": 0, "col": 0, "state": "done" }, { "row": 0, "col": 1, "state": "done" }, { "row": 1, "col": 0, "state": "done" }, { "row": 1, "col": 3, "state": "active" }] }
    },
    {
      "caption": "Flood-fill from (1,3) through (2,3), (2,2), (3,2). This second island has area 4.",
      "visual": { "type": "grid", "rows": [[1, 1, 0, 0], [1, 0, 0, 1], [0, 0, 1, 1], [0, 0, 1, 0]], "highlights": [{ "row": 0, "col": 0, "state": "done" }, { "row": 0, "col": 1, "state": "done" }, { "row": 1, "col": 0, "state": "done" }, { "row": 1, "col": 3, "state": "match" }, { "row": 2, "col": 3, "state": "match" }, { "row": 2, "col": 2, "state": "match" }, { "row": 3, "col": 2, "state": "match" }] }
    },
    {
      "caption": "Compare the areas 3 and 4. The largest island area is 4.",
      "visual": { "type": "grid", "rows": [[1, 1, 0, 0], [1, 0, 0, 1], [0, 0, 1, 1], [0, 0, 1, 0]], "highlights": [{ "row": 0, "col": 0, "state": "done" }, { "row": 0, "col": 1, "state": "done" }, { "row": 1, "col": 0, "state": "done" }, { "row": 1, "col": 3, "state": "done" }, { "row": 2, "col": 3, "state": "done" }, { "row": 2, "col": 2, "state": "done" }, { "row": 3, "col": 2, "state": "done" }] }
    }
  ]
}
