{
  "schemaVersion": 1,
  "id": "range-sum-query",
  "subject": "dsa",
  "track": "prefix-sums",
  "title": "Range Sum Query",
  "difficulty": "easy",
  "summary": "Precompute prefix sums once. Then the sum of any range is prefix[r] minus prefix[l-1], a single subtraction instead of a loop.",
  "problem": "After one preprocessing pass, answer any range-sum query in O(1).",
  "example": { "input": "[2, 4, 1, 3, 5], sum of indices 1..3", "output": "8" },
  "steps": [
    {
      "caption": "We'll answer many 'sum from i to j' queries. Precompute once, then answer each in O(1).",
      "visual": { "type": "array", "cells": [2, 4, 1, 3, 5] }
    },
    {
      "caption": "Prefix sums: cell k holds the sum of the first k+1 values. Build it in one pass to [2, 6, 7, 10, 15].",
      "visual": { "type": "array", "cells": [2, 6, 7, 10, 15], "highlights": [{ "range": [0, 4], "state": "done" }] }
    },
    {
      "caption": "Query: sum of indices 1 through 3. Take prefix[3] = 10, then subtract prefix[0] = 2 (everything before index 1).",
      "visual": { "type": "array", "cells": [2, 6, 7, 10, 15], "highlights": [{ "index": 0, "state": "compare" }, { "index": 3, "state": "compare" }] }
    },
    {
      "caption": "10 - 2 = 8 is the range sum, with no loop. In general, range [l, r] = prefix[r] - prefix[l-1].",
      "visual": { "type": "array", "cells": [2, 6, 7, 10, 15], "highlights": [{ "index": 3, "state": "done" }] }
    }
  ]
}
