{
  "schemaVersion": 1,
  "id": "selection-sort",
  "subject": "dsa",
  "track": "sorting",
  "title": "Selection Sort",
  "difficulty": "easy",
  "summary": "Scan the unsorted part for its smallest value, then swap that value to the front of the unsorted part. Repeat until everything is placed.",
  "problem": "Sort ascending by repeatedly selecting the smallest remaining value and placing it at the front of the unsorted region.",
  "example": { "input": "[5, 1, 4, 2]", "output": "[1, 2, 4, 5]" },
  "steps": [
    {
      "caption": "Selection sort: scan the unsorted part for the smallest value, then swap it to the front of that part.",
      "visual": { "type": "array", "style": "bars", "cells": [5, 1, 4, 2] }
    },
    {
      "caption": "Pass 1: the smallest of all four values is 1, at index 1.",
      "visual": { "type": "array", "style": "bars", "cells": [5, 1, 4, 2], "pointers": [{ "label": "i", "index": 0 }], "highlights": [{ "index": 1, "state": "active" }] }
    },
    {
      "caption": "Swap it into index 0. The front is now sorted.",
      "visual": { "type": "array", "style": "bars", "cells": [1, 5, 4, 2], "highlights": [{ "index": 0, "state": "done" }] }
    },
    {
      "caption": "Pass 2: the smallest of the rest (5, 4, 2) is 2, at index 3.",
      "visual": { "type": "array", "style": "bars", "cells": [1, 5, 4, 2], "pointers": [{ "label": "i", "index": 1 }], "highlights": [{ "index": 0, "state": "done" }, { "index": 3, "state": "active" }] }
    },
    {
      "caption": "Swap it into index 1. Two values settled.",
      "visual": { "type": "array", "style": "bars", "cells": [1, 2, 4, 5], "highlights": [{ "range": [0, 1], "state": "done" }] }
    },
    {
      "caption": "Pass 3: the smallest of the rest (4, 5) is 4 — already in place.",
      "visual": { "type": "array", "style": "bars", "cells": [1, 2, 4, 5], "pointers": [{ "label": "i", "index": 2 }], "highlights": [{ "range": [0, 1], "state": "done" }, { "index": 2, "state": "active" }] }
    },
    {
      "caption": "Nothing to move, and the last value falls in line too. Sorted: [1, 2, 4, 5].",
      "visual": { "type": "array", "style": "bars", "cells": [1, 2, 4, 5], "highlights": [{ "range": [0, 3], "state": "done" }] }
    }
  ]
}
